{
  "$schema": "https://json-schema.org/draft/2020-12/schema",
  "$id": "https://smith.cliwright.dev/schemas/project-type.v1.json",
  "title": "Smith Project Type",
  "description": "A versioned project-type definition from the registry (project-type.json). Name and version must match the registry layout: <language>/<flavor>/<kind>/v<version>/project-type.json.",
  "type": "object",
  "additionalProperties": false,
  "required": ["name", "version", "description", "tools", "targets"],
  "properties": {
    "name": {
      "description": "Type name, language/flavor/kind. Flavor is mandatory: 'std' when the language has a standard toolchain, otherwise an arbitrary string unique within the language namespace.",
      "type": "string",
      "pattern": "^[a-z][a-z0-9-]*(/[a-z][a-z0-9-]*){2}$"
    },
    "version": {
      "description": "Type version. Must equal the version directory in the registry path (app-level check).",
      "type": "integer",
      "minimum": 1
    },
    "description": {
      "type": "string",
      "minLength": 1
    },
    "capabilities": {
      "description": "What this type of project can do, independent of how. Optional and non-load-bearing in the MVP.",
      "type": "array",
      "items": {
        "type": "string",
        "enum": [
          "buildable",
          "testable",
          "lintable",
          "formattable",
          "runnable",
          "packageable",
          "validatable",
          "planable",
          "applicable",
          "deployable"
        ]
      },
      "uniqueItems": true
    },
    "tools": {
      "description": "Tools required on PATH to run this type's targets (BYOT). Version constraints may be added later.",
      "type": "array",
      "minItems": 1,
      "items": { "type": "string", "minLength": 1 },
      "uniqueItems": true
    },
    "working_dir": {
      "description": "Where targets execute: the project directory (default) or the repository root (e.g. docker build contexts). Exactly these two values — no arbitrary paths.",
      "type": "string",
      "enum": ["project", "repo"],
      "default": "project"
    },
    "targets": {
      "description": "Named targets, each run as an ordered list of shell command steps (the first non-zero exit fails the target). Each target is either a bare steps array, or an object with the steps plus an optional short description (~80 chars) shown in target listings. Target names may carry one dot segment (e.g. \"env.get\") for namespaced tooling-type targets; the dotted name is an opaque single token everywhere targets are named (runs, help, lists, --context, depends_on).",
      "type": "object",
      "minProperties": 1,
      "patternProperties": {
        "^[a-z][a-z0-9-]*(\\.[a-z][a-z0-9-]*)?$": {
          "oneOf": [
            {
              "description": "Bare form: just the steps.",
              "type": "array",
              "minItems": 1,
              "items": { "type": "string", "minLength": 1 }
            },
            {
              "description": "Described form: steps plus a short description for list views.",
              "type": "object",
              "additionalProperties": false,
              "required": ["steps"],
              "properties": {
                "description": { "type": "string", "maxLength": 80 },
                "steps": {
                  "type": "array",
                  "minItems": 1,
                  "items": { "type": "string", "minLength": 1 }
                }
              }
            }
          ]
        }
      },
      "additionalProperties": false
    },
    "depends_on": {
      "description": "Target dependency map: target -> targets that must complete first. Referenced target names, self-references, and cycles are validated by smith (not expressible here).",
      "type": "object",
      "patternProperties": {
        "^[a-z][a-z0-9-]*(\\.[a-z][a-z0-9-]*)?$": {
          "type": "array",
          "minItems": 1,
          "items": { "type": "string", "minLength": 1 },
          "uniqueItems": true
        }
      },
      "additionalProperties": false
    },
    "params": {
      "description": "Params this type exposes to its steps and environment values via {{.name}} templates. Defaults are required; manifests may override.",
      "type": "object",
      "additionalProperties": false,
      "patternProperties": {
        "^[a-z][a-z0-9_]*$": {
          "type": "object",
          "additionalProperties": false,
          "required": ["default"],
          "properties": {
            "default": { "type": "string" },
            "description": { "type": "string" }
          }
        }
      }
    },
    "environment": {
      "description": "Environment variables for this type's target steps. Values are Go templates over the merged params (type defaults <- manifest overrides).",
      "type": "object",
      "additionalProperties": { "type": "string" }
    }
  }
}
